{
  "schema_version": 1,
  "generated_at": "2026-05-04T00:00:00.000Z",
  "spec_sha256": "0000000000000000000000000000000000000000000000000000000000000000",
  "spec_version": "0.9.0",
  "endpoints": {
    "email_finder": {
      "name": "email_finder",
      "path": "/email_finder",
      "capability_group": "email_and_phone",
      "spec_tag": "Enrichment",
      "pricing": {
        "model": "unknown",
        "credits_per_call": null,
        "credits_base": null,
        "credits_per_result": null,
        "result_count_field": null,
        "billing_field_present_in_response": false,
        "bounded": true,
        "disabled_by_default": false,
        "disabled_reason": null
      },
      "required_request_fields": [],
      "request_body_required": false,
      "bulk_variant": null,
      "max_batch": null,
      "field_map": null,
      "field_map_status": "TODO_no_usable_example",
      "deprecated": false
    },
    "phone_finder": {
      "name": "phone_finder",
      "path": "/phone_finder",
      "capability_group": "email_and_phone",
      "spec_tag": "Enrichment",
      "pricing": {
        "model": "flat",
        "credits_per_call": 3,
        "credits_base": null,
        "credits_per_result": null,
        "result_count_field": null,
        "billing_field_present_in_response": true,
        "bounded": true,
        "disabled_by_default": false,
        "disabled_reason": null
      },
      "required_request_fields": [],
      "request_body_required": false,
      "bulk_variant": null,
      "max_batch": null,
      "field_map": null,
      "field_map_status": "TODO_no_usable_example",
      "deprecated": false
    },
    "web_scrape": {
      "name": "web_scrape",
      "path": "/web_scrape",
      "capability_group": "web_intelligence",
      "spec_tag": "Web Scraping",
      "pricing": {
        "model": "flat",
        "credits_per_call": 2,
        "credits_base": null,
        "credits_per_result": null,
        "result_count_field": null,
        "billing_field_present_in_response": true,
        "bounded": true,
        "disabled_by_default": false,
        "disabled_reason": null
      },
      "required_request_fields": ["url"],
      "request_body_required": true,
      "bulk_variant": null,
      "max_batch": null,
      "field_map": null,
      "field_map_status": "TODO_no_usable_example",
      "deprecated": false
    },
    "linkedin_job_detail": {
      "name": "linkedin_job_detail",
      "path": "/linkedin_job_detail",
      "capability_group": "enrichment",
      "spec_tag": "Enrichment",
      "pricing": {
        "model": "flat",
        "credits_per_call": 1,
        "credits_base": null,
        "credits_per_result": null,
        "result_count_field": null,
        "billing_field_present_in_response": true,
        "bounded": true,
        "disabled_by_default": false,
        "disabled_reason": null
      },
      "required_request_fields": [],
      "request_body_required": false,
      "bulk_variant": null,
      "max_batch": null,
      "field_map": null,
      "field_map_status": "TODO_no_usable_example",
      "deprecated": false
    },
    "google_maps_places_scraper": {
      "name": "google_maps_places_scraper",
      "path": "/google_maps_places_scraper",
      "capability_group": "maps_directories",
      "spec_tag": "Maps",
      "pricing": {
        "model": "per_result",
        "credits_per_call": null,
        "credits_base": null,
        "credits_per_result": 0.1,
        "result_count_field": "_list_count",
        "billing_field_present_in_response": false,
        "bounded": true,
        "disabled_by_default": false,
        "disabled_reason": null
      },
      "required_request_fields": ["search_query"],
      "request_body_required": true,
      "bulk_variant": null,
      "max_batch": null,
      "field_map": null,
      "field_map_status": "TODO_no_usable_example",
      "deprecated": false
    },
    "find_emails": {
      "name": "find_emails",
      "path": "/find_emails",
      "capability_group": "email_and_phone",
      "spec_tag": "Waterfall",
      "pricing": {
        "model": "flat",
        "credits_per_call": 2,
        "credits_base": null,
        "credits_per_result": null,
        "result_count_field": null,
        "billing_field_present_in_response": true,
        "bounded": true,
        "disabled_by_default": false,
        "disabled_reason": null
      },
      "required_request_fields": ["data"],
      "request_body_required": true,
      "bulk_variant": null,
      "max_batch": null,
      "field_map": null,
      "field_map_status": "TODO_no_usable_example",
      "deprecated": false
    },
    "profile_search": {
      "name": "profile_search",
      "path": "/profile_search",
      "capability_group": "people_search",
      "spec_tag": "Search",
      "pricing": {
        "model": "per_result",
        "credits_per_call": null,
        "credits_base": null,
        "credits_per_result": 0.1,
        "result_count_field": "elements",
        "billing_field_present_in_response": true,
        "bounded": true,
        "disabled_by_default": false,
        "disabled_reason": null
      },
      "required_request_fields": ["search"],
      "request_body_required": true,
      "bulk_variant": null,
      "max_batch": null,
      "field_map": null,
      "field_map_status": "TODO_no_usable_example",
      "deprecated": false
    },
    "clean_domain": {
      "name": "clean_domain",
      "path": "/clean_domain",
      "capability_group": "utilities",
      "spec_tag": "Utilities",
      "pricing": {
        "model": "flat",
        "credits_per_call": 0.5,
        "credits_base": null,
        "credits_per_result": null,
        "result_count_field": null,
        "billing_field_present_in_response": true,
        "bounded": true,
        "disabled_by_default": false,
        "disabled_reason": null
      },
      "required_request_fields": ["domain"],
      "request_body_required": true,
      "bulk_variant": null,
      "max_batch": null,
      "field_map": null,
      "field_map_status": "TODO_no_usable_example",
      "deprecated": false
    }
  }
}
